author,title,publish_place
 Francisca Contreras,Contenido del Artículo: RESUMEN,Investigación y Educación en Enfermería
 Francisca Contreras,INVITED SPEAKERS KEYNOTE SPEAKERS,Journal of Women's Health
 Francisca Contreras,PaDA: Patrón de Distribución con Aspectos,N/A
 Carlos A. Santiviago,Novel Template Plasmids pCyaA’-Kan and pCyaA’-Cam for Generation of Unmarked Chromosomal cyaA’ Translational Fusion to T3SS Effectors in Salmonella,Microorganisms
 Carlos A. Santiviago,Mucosal immunization of BALB/c mice with DNA vaccines encoding the SEN1002 and SEN1395 open reading frames of Salmonella enterica serovar Enteritidis induces protective immunity,Epidemiology & Infection
 Carlos A. Santiviago,The type VI secretion systems encoded in Salmonella pathogenicity islands SPI-6 and SPI-19 contribute to intestinal colonization of chickens and systemic spread by Salmonella …,Infection and immunity
 Carlos A. Santiviago,Bioinformatic and experimental characterization of SEN1998: a conserved gene carried by the Enterobacteriaceae-associated ROD21-like family of genomic islands,Scientific reports
 Carlos A. Santiviago,Identification of Type VI Secretion Systems Effector Proteins That Contribute to Interbacterial Competition in Salmonella Dublin,Frontiers in Microbiology
 Xin Deng,"Correction for Zhang et al.,“Pseudomonas aeruginosa Regulatory Protein AnvM Controls Pathogenicity in Anaerobic Environments and Impacts Host Defense”",MBio
 Xin Deng,Correction: DNA Repair Interacts with Autophagy To Regulate Inflammatory Responses to Pulmonary Hyperoxia,The Journal of Immunology
 Xin Deng,"DNA repair interacts with autophagy to regulate inflammatory responses to pulmonary hyperoxia (vol 198, pg 2844, 2017)",The Journal of Immunology
 Xin Deng,"Comment on"" DNA Repair Interacts with Autophagy To Regulate Inflammatory Responses to Pulmonary Hyperoxia"" Response",The Journal of Immunology
 Xin Deng,"Response to Comment on"" DNA Repair Interacts with Autophagy To Regulate Inflammatory Responses to Pulmonary Hyperoxia""","Journal of immunology (Baltimore, Md.: 1950)"
 Chuan He,Structural basis of enzymatic benzene ring reduction,Nature chemical biology
 Chuan He,"Lan Jiang, Ph. D.",Progress in polymer science
 Chuan He,您正在访问: 人气: 2,N/A
 Chuan He,The Graduate Program in Biophysical Sciences,N/A
 Chuan He,Supporting Information To Engineered Holliday Junctions as Single-Molecule Reporters for Protein-DNA Interactions with Application to a MerR-family Regulator,Journal of the American Chemical Society
 Min Wu,MEMS-BASED STORAGE,ACM SIGARCH Computer Architecture News
 Min Wu,International Journal Devoted to Research and Development of Physical and Chemical Transducers,N/A
 Min Wu,Monolithic colliding pulse mode-locked semiconductor lasers,Quantum and Semiclassical Optics: Journal of the European Optical Society Part B
 Min Wu,Optoelectronic Tweezers for Cell and Nanoparticle Manipulation,N/A
 Min Wu,Large-scale silicon photonic switches with movable directional couplers: supplementary material,N/A
 Dennise deJesus,"Lima Bendezu, Maria 80 Martín del Campo Aceves, I. 94",N/A
 Dennise deJesus,Design and Evaluation of a Dashboard for the Analysis of Learner Behavior and Prediction of Dropout in Moodle......................................................... 1 Bryan …,N/A
 Dennise deJesus,Repositorio portable para objetos de aprendizaje para escuelas sin conexión a internet,N/A
 Dennise deJesus,Búsqueda de Reglas de Asociación para la Predicción de Terremotos Searching for Association Rules to Forecast Earthquakes,N/A
 Dennise deJesus,Kusa-yupaq: Aplicación móvil para mejorar el inventario de bienes patrimoniales,N/A
 Tingting Liu,Optimization of Key Processing Parameters for Preparation of Corn Cyclo (His-Pro) by High Temperature/High Pressure Method,N/A
 Tingting Liu,Optimization of High Pressure/Temperature Assisted Synthesis of Cyclo (His-Pro),N/A
 Tingting Liu,What influence residents’ willingness towards “Internet+” recycling behaviour,N/A
 Tingting Liu,Improved SC-FDE System and its Performance Analysis in Aeronautical Channels,N/A
 Tingting Liu,SC-FDE System Based on Turbo Channels Encoding,N/A
 Li Yu,"A 400Msample/s, 8-bit, CMOS Folding and Interpolating Analog-to-Digital Converter",N/A
 Li Yu,Visible light photocatalysis: TiO 2 sensitized by WS 2 and MoS 2,Langmuir
 Li Yu,Fabrication of Nanomaterials for Energy and Environmental Applications,Nanomaterials
 Li Yu,Redox-Responsive Controlled Gene Transfection Based on Polymer-Conjugated Magnetic Nanoparticles,N/A
 Li Yu,DIRECT SONOCHEMICAL PREPARATION OF HIGHLY PHOTOACTIVE MESOPOROUS TITANIUM DIOXIDE WITH A BICRYSTALLINE FRAMEWORK,N/A
 Qing Li,基于 PSO 优化的 HAPC 系统自抗扰控制器,N/A
 Qing Li,A RESEARCH OF ADOLESCENTS’EXPERIENCE OF CYBER-HARASSMENT,Journal of educational computing research
 Qing Li,C REVIEWS,The Lancet
 Qing Li,Search journal,International Journal of Hospitality Management
 Qing Li,Ultrahigh-Sensitivity Fiber Acoustic Sensor With a Dual Cladding Modes Fiber Up-Taper Interferometer.............,IEEE Photonics Technology Letters
 Lili Liu,Primary structure and expression of a chicken laminin β chain: Evidence for four β chains in birds,N/A
 Lili Liu,Genomic structure and chromosomal location of a novel extracellular matrix protein from mammalian vitreous,Investigative Ophthalmology & Visual Science
 Lili Liu,"Addition of ramucirumab or merestinib to standard first-line chemotherapy for locally advanced or metastatic biliary tract cancer: a randomised, double-blind, multicentre …",N/A
 Lili Liu,"NUCLEIC ACIDS, PROTEIN SYNTHESIS, AND MOLECULAR GENETICS-Complete sequence of the 23-kilobase human COL9A3 gene. Detection of Gly-XY triplet deletions that represent neutral …",Journal of Biological Chemistry
 Min Sun,HWISE-2012 Reviewer List,N/A
 Min Sun,Single-Port Laparoscopic Left Hemihepatectomy for Hepatocellular Carcinoma with Liver Cirrhosis,N/A
 Min Sun,Л 肝癌切除术中输血与患者预后关系的探讨,N/A
 Min Sun,NANOFLUIDS CONTAINING CARBON-COATED IRON NANOPARTICLES AND ITS APPLIED RESEARCH IN RADIOFREQUENCY ABLATION,N/A
 Min Sun,"Kagawa, Y. 36 Kakazey, M. 111 Kalidindi, SR 95 Kamp, N. 241",Jia
 Wenyang Dong,Characterization and complete genome sequence analysis of Staphylococcus aureus bacteriophage JS01,Virus Genes
 Wenyang Dong,Comparative genetic analyses provide clues about capsule switching in Streptococcus suis 2 strains with different virulence levels and genetic backgrounds,Microbiological Research
 Wenyang Dong,"CrfP, a fratricide protein, contributes to natural transformation in Streptococcus suis",Veterinary research
 Wenyang Dong,Comparative genomic analyses provide clues to capsule switch in Streptococcus suis,bioRxiv
 Wenyang Dong,A novel variant serotype of Streptococcus suis from the piglets caused meningitis,Applied and environmental microbiology
 Zihao Pan,"Stigma, discrimination, and hate crimes in Chinese-speaking world amid COVID-19 pandemic",Asian journal of criminology
 Wei Zhang,Supplemental material to:“Nonlinear modeling of protein expressions in protein arrays”,N/A
 Wei Zhang,Microarray Production: Quality of DNA and Printing,Applied microbiology and biotechnology
 Wei Zhang,Scanners and Data Acquisition,Applied Sciences
 Wei Zhang,Quality Control in Data Analysis,N/A
 Wei Zhang,Transcriptome and Small RNA Deep Sequencing Reveals Deregulation of,The Journal of pathology
 N. Ohashi,"J. Sol-Gel Sci. Tech. J. Sol-Gel Sci. Tech. 2, 457, 1994",Journal of Sol-Gel Science and Technology
 N. Ohashi,KTB,Journal of Geophysical Research: Solid Earth
 N. Ohashi,"Proc. 10th IEEE Int. Symp. Appl. Ferroelectr. Proc. 10th IEEE Int. Symp. Appl. Ferroelectr. 193, 1996",N/A
 N. Ohashi,"J. Sol-Gel Sci. Tech. J. Sol-Gel Sci. Tech. 5, 185, 1995",Chemistry of materials
 N. Ohashi,"J. Europ. Ceram. Soc. J. Europ. Ceram. Soc. 19, 999, 1999",N/A
 Y. Rikihisa,Anaplasma phagocytophila Effects of,Veterinary parasitology
 Y. Rikihisa,Comparison of Two Recombinant Major,Clinical Diagnostic Laboratory Immunology
 Y. Rikihisa,Ehrlichia canis Tick Acquisition of,Veterinary parasitology
 Y. Rikihisa,Identification of 19 Polymorphic Major,N/A
 Y. Rikihisa,Ticks and Tick-Borne Pathogens,Frontiers in cellular and infection microbiology
 Amanda Savoie,Canadian Museum of Nature,Journal of the American Institute for Conservation
 Amanda Savoie,Molecular and morphological data reveal hidden diversity in common North American Frustulia species (Amphipleuraceae),Diatom Research
 Amanda Savoie,ESTABLISHING SPECIES LIMITS AND PHYLOGENETIC RELATIONSHIPS FOR NORTHWEST ATLANTIC POLYSIPHONIA (RHODOPHYTA) USING AN INTEGRATED TAXONOMIC APPROACH,JOURNAL OF PHYCOLOGY
 Amanda Savoie,Kelp in the Eastern Canadian Arctic: current and future predictions of habitat suitability and cover,Frontiers in Marine Science
 Amanda Savoie,"Species diversity and phylogenetic relationships within the family Rhodomelaceae (Ceramiales, Rhodophyta) in Canada",N/A
 Hiroshi Asakura,SU‐FF‐J‐47: Determination of Internal Target Volume Reconstruction Algorithm Beyond the Time Dimension Using Second Model of a 256‐Slice CT,Medical Physics
 Hiroshi Asakura,SU‐FF‐J‐23: Improved Temporal Resolution by Respiratory Gated Segment Reconstruction: Towards Four‐Dimensional (4D) Radiation Therapy for Heavy Ion Beams Using the 256‐Detector …,Medical Physics
 Hiroshi Asakura,Clinical utility of the probability of uncomplicated local control (PULC) in heavy ion radiotherapy,N/A
 Hiroshi Asakura,362 Improved Respiratory Gated CT Scan Method,N/A
 Hiroshi Asakura,Study for clinical utility of PULC,Nature Reviews Genetics
 Testuya Ikeda,A future perspective of enhancing coping capacity to flood disasters in Japan by utilizing Flood Hazard Maps,Journal of the Japan Society of Hydrology & Water Resources
 Testuya Ikeda,Evaluation of the effects by implementing and improving the ‘F lood H azard M apping T raining C ourse’,Journal of Flood Risk Management
 Testuya Ikeda,SUMMARY OF TRAINING COURSE ON'FLOOD HAZARD MAPPING',N/A
 Testuya Ikeda,"SS6-4 SUMMARY OF TRAINING COURSE ON"" FLOOD HAZARD MAPPING""",N/A
 Testuya Ikeda,"World Water Actions. Summary and recommendations.(Documento del Tercer Congreso Mundial del Agua, realizado en Kyoto, 16-23 de Marzo 2003)..",N/A
 Chihiro Sasakawa,Escape of intracellular Shigella from autophagy,Science
 Kwok-Hung Chan,Chronic Lateral Ankle Pain–Overcrowding Due To Peroneus Quartus Muscle.,N/A
 Kwok-Hung Chan,"Comparative analytical evaluation of six rapid influenza A antigen detection test kits for detection of influenza A subtypes H1N1, H3N2 and H5N1",Journal of clinical virology
 Kwok-Hung Chan,Direct Detection of Rifampin-Resistant,Journal of clinical microbiology
 Kwok-Hung Chan,Quasi-static Computational Electromagnetic Analysis for Dosimetry in Grounded and Ungrounded Body due to Contact Current,N/A
 Kwok-Hung Chan,Human Parainfluenza Virus 4 Outbreak and,Journal of clinical microbiology
 Hiroshi Yamasaki,"Published Ahead-of-Print-Last Updated: January 13, 2021",N/A
 Hiroshi Yamasaki,SNP Communication,"2004 International Conference on Communications, Circuits and Systems (IEEE Cat. No. 04EX914)"
 Hiroshi Yamasaki,SNP Communication A Major Genotype in UDP-glucuronosyltransferase 2B15,N/A
 Hiroshi Yamasaki,SNP Communication Twenty One Novel Single Nucleotide Polymorphisms (SNPs) of the CYP2A6 Gene in Japanese and Caucasians,Drug metabolism and pharmacokinetics
 Hiroshi Yamasaki,Genetic polymorphisms of Drug metabolizing enzymes,The pharmacogenomics journal
 Ning Xiao,SiN-based Meta-hologram Combining Up-conversion Nanoparticles,Asia Communications and Photonics Conference
 Ning Xiao,Effects of Laser Micro-Machining on LED's Luminous Performance,2017 Asia Communications and Photonics Conference (ACP)
 Ning Xiao,LED holographic imaging by spatial-domain diffraction computation of textured models,"Holography, Diffractive Optics, and Applications VI"
 Ning Xiao,Spatial-Domain Computer Generated Holographic Three-Dimensional Display,N/A
 Naoki Sato,A novel three-dimensional/four-dimensional ultrasound analysis of the effect of the transfer position in in vitro fertilization and embryo transfer on the pregnancy rate,秋田医学
 Naoki Sato,Cesarean scar caseating granuloma: a case of vesicouterine fistula 30 years after cesarean section,Clinical Case Reports
 Naoki Sato,マウス着床前期胚における HtrA2/Omi の発現とアポトーシスおよびフラグメンテーションへの関与に関する研究,N/A
 Naoki Sato,マウス着床前期胚における leptin の発育促進作用について,N/A
 Naoki Sato,Unique Doppler velocimetry findings in heart failure of a fetus with giant cardiac rhabdomyoma,Journal of obstetrics and gynaecology research
 Renaud Piarroux,Actualités dans les pneumopathies d'hypersensibilité (PHS) en milieu rural,N/A
 Renaud Piarroux,MALDI-TOF,Molecular biotechnology
 Renaud Piarroux,MALARIA DE LOS PRIMATES NO HUMANOS,ZOONOSIS Y ENFERMEDADES TRANSMISIBLES COMUNES AL HOMBRE YA LOS ANIMALES
 Renaud Piarroux,Antimony Molecular Resistance Markers in Leishmania Field Isolates Collected in the Maghreb and Southern France: A Geography-and Species-Associated Mosaic.,Fakhri JEDDI
 Renaud Piarroux,"Magali Gautier, Justin Michel, Anne-Cécile Normand, Carole Cassagne",N/A
 Akira Ito,奈良春日山カナクギノキに歪んだ性比をもたらすシカの摂食庄,N/A
 Akira Ito,ナギの種子落下速度 (御蓋山ナギの分布域拡大 3),N/A
 Akira Ito,"Construction of a gene-data bank of tropical rainforest tree species in Sarawak, Malaysia",Tropics
 Akira Ito,御蓋山のナギとイヌガシの個体群構造,N/A
 Akira Ito,壊滅的森林撹乱が引き起こすアレロバシーの予測 (御蓋山ナギの分布域拡大 2),N/A
 Laura Garci_a,A Genetic Risk Score Predicts Recurrent Events After Myocardial Infarction in Young Adults,Revista Española de Cardiología (English Edition)
 Laura Garci_a,Traditional Chinese Medicine in Cancer: Recent Progress in Animal Studies,Journal of Traditional and Complementary Medicine
 Laura Garci_a,Sainz B Jr,N/A
 Laura Garci_a,Prostaglandins induce early growth response 1 transcription factor mediated microsomal prostaglandin E,Oncotarget
 Laura Garci_a,Li Yuspa SHandKazanietzMG (2000) InvolvementofproteinkinaseCdelta (PKCdelta) in phorbol ester-induced apoptosis in LNCaP prostate cancer cells. Lack of proteolytic cleavage of …,Journal of Biological Chemistry
 Olga Hidalgo,Ejecución académica básica de mujeres adultas mayores en proceso de alfabetización,N/A
 Olga Hidalgo,Mejora escolar mediante el proyecto ético de vida,N/A
 Olga Hidalgo,Evaluación para transformar: función formadora.,N/A
 Olga Hidalgo,Desarrollo Sostenible en Profesionales de la Educación desde el Enfoque Socioformativo.,N/A
 Olga Hidalgo,"ALFABETIZACIÓN TECNOLÓGICA, NECESARIA PARA LA SOCIEDAD DEL CONOCIMIENTO",N/A
 Jos L. Prez,Marcadores Predictivos o Pronósticos,Actas urológicas españolas
 Jos L. Prez,ACTUALIZACIÓN DE INMUNOTERAPIA EN CÁNCER RENAL,N/A
 Jos L. Prez,QUIMIOTERAPIA Y NUEVOS FÁRMACOS EN INVESTIGACIÓN EN LA ENFERMEDAD AVANZADA HORMONOSENSIBLE: INHIBIDORES DE LA SÍNTESIS DE ANDRÓGENOS,Ponencias y Comunicaciones
 Jos L. Prez,Poster Title,Oncol
 Jos L. Prez,非小细胞肺癌患者的细胞学染色涂片中表皮生长因子受体和 K-Ras 突变状态的评估： 与临床转归的相关性,N/A
 David R. Smith,design guide,Learning to solve problems: An instructional design guide
 David R. Smith,"Mesenchymal stem cells loaded with p5, from p35, Inhibit calcium-induced CDK5 Activation in Endothelial Cells",N/A
 David R. Smith,Command Generation for Planetary Rovers Using Virtual Reality,"Artificial Intelligence, Robotics and Automation in Space"
 David R. Smith,A Big or Divided Society?,"Final Recommendations and Report of the Panel Review into the Coalition Government Policy on Gypsies and Travellers, Travellers Aid Trust, Carmarthenshire"
 David R. Smith,The Concept of Hope in Family Caregivers of Cancer,Journal of Hospice & Palliative Nursing
 Rahmah Noordin,In vitro antiparasitic activity of Root Extracts Eurycoma longifolia,N/A
 Rahmah Noordin,Analysis Of Entamoeba Histolytica Antigens For Improved Diagnosis Of Amoebiasis,The American journal of tropical medicine and hygiene
 Rahmah Noordin,An in-vivo induced antigen of Toxoplasma gondii with high sensitivity and specificity for detection of anti-Toxoplasma IgM antibodies,N/A
 Rahmah Noordin,Use of prednisolone to aid propagation,N/A
 Rahmah Noordin,Production and Confirmation of Monoclonal Antibody against IgG4 Hinge Region Recombinant Protein,Analytical biochemistry
 Peyman Keyhanvar,MITRAL VALVE PROLAPSE AND GIANT CORONARY ARTERY ANEURYSMS (SCASE REPORT),Iranian Heart Journal
 Peyman Keyhanvar,Human Adipocyte Derived Mesenchymal Stem cell supports keratinocyte growth in a modified Collagen-Hyalorunic acid matrix,BONE MARROW TRANSPLANTATION
 Peyman Keyhanvar,"Neurogenesis and Increase in Differentiated Neural Cell Survival via Phosphorylation of Akt1 after Fluoxetine Treatment of Stem Cells (vol 2013, 582526, 2013)",BioMed Research International
 Peyman Keyhanvar,Nanoneurology; An Applied Categorizing of Nanotechnology Potentials in Neurology Improvement,The Handbook of Nanomedicine
 Peyman Keyhanvar,P98-Human Adipocyte Derived Mesenchymal Stromal Cell Supports Keratinocyte Growth in a Modified Collagen-Hyalorunic Acid Matrix,N/A
 Alireza Shoae-Hassani,"Neurogenesis and Increase in Differentiated Neural Cell Survival via Phosphorylation of Akt1 after Fluoxetine Treatment of Stem Cells (vol 2013, 582526, 2013)",BioMed Research International
 Alireza Shoae-Hassani,O6-Regenerative Medicine: From Past to Present and the Future,N/A
 Alireza Shoae-Hassani,Utilization of Lambda bacteriophage as an Apoptin effective delivery platform to the BT-474 human breast carcinoma.,N/A
 Alireza Shoae-Hassani,Activation of Natural killer cells with interleukin 21 in the treatment of preclinical Neuroblastoma model,N/A
 Alireza Shoae-Hassani,P98-Human Adipocyte Derived Mesenchymal Stromal Cell Supports Keratinocyte Growth in a Modified Collagen-Hyalorunic Acid Matrix,N/A
 Amir Darbandi-Azar,Prevention of kidney injury after myocardial ischemia reperfusion is achievable with short-term protein restriction,Journal of Renal Injury Prevention
 Amir Darbandi-Azar,Does Continuous ELF-EMF Exposure Harms Liver Tissue? A Microscopic Assay,N/A
 Amir Darbandi-Azar,"Neurogenesis and Increase in Differentiated Neural Cell Survival via Phosphorylation of Akt1 after Fluoxetine Treatment of Stem Cells (vol 2013, 582526, 2013)",BioMed Research International
 Amir Darbandi-Azar,Hepatic Radioembolisation of Yttrium-90 Microspheres in Animal Model,International Journal of Radiation Oncology* Biology* Physics
 Amir Darbandi-Azar,SuS,N/A
 Asli Semiz,"Genetic polymorphisms of drug-metabolizing enzymes CYP2C9, CYP2D6, and CYP3A4 in the Turkish population",N/A
 Asli Semiz,Antioxidant and chemoprotective properties of Momordica charantia L.,African journal of Biotechnology
 Asli Semiz,Effects of metals and detergents on biotransformation and detoxification,Ecotoxicology and Environmental Safety
 Asli Semiz,Protective effects of annual nettle against chemical carcinogens,N/A
 Asli Semiz,Biochemical characterization and distribution of glutathione,Biochemistry (Moscow)
 Serdar Karakurt,INHIBITORY EFFECT OF TANNIC ACID ON GLUTATHIONE S-TRANSFERASE ACTIVITY IN RABBIT LIVER AND KIDNEY,DRUG METABOLISM REVIEWS
 Serdar Karakurt,Antioxidant activity of fresh and fermented fruits of Viburnum opulus and comparison of their phenolic and organic acid contents by HPLC,N/A
 Serdar Karakurt,Cytotoxic potential of Viburnum opulus against human colorectal carcinoma,N/A
 Serdar Karakurt,Regulation of cell cycle and apoptosis of human colorectal carcinoma cells via Viburnum opulus,N/A
 Orhan Adali,Genetic polymorphisms of thiopurine methyltransferase enzyme in children with acute lympoblastic leukemia in Turkish population: A preliminary study on TPMT* 3A and TPMT* 3C …,American journal of hematology
 Orhan Adali,Diabetes potentiates metabolic activation of procarcinogen nitrosodimethylamine not only in rabbit liver but also in lung and kidney,DRUG METABOLISM REVIEWS
 Orhan Adali,Characterization and Structure-Function Studies of Human Liver Flavin Monooxygenase Isozyme 3 (FMO3),Turkish Journal of Zoology
 Orhan Adali,"BIOLOGICAL OXIDATIONS: FREE RADICALS, NITRIC OXIDE, ANTIOXIDANTS, AND P450 REACTIONS-Modulation of Human Flavin-Containing Monooxygenase 3 Activity by Tricyclic Antidepressants …",Archives of Biochemistry and Biophysics
 Orhan Adali,Effects of pyridine on rabbit liver and lung microsomal N-nitrosodimethylamine N-demethylase and aniline 4-hydroxylase enzyme activities,Toxicology Letters
 Alaattin Sen,"pyrene (B (a) P] on fish liver microsomal MFO enzymes were investigated. B (a) was administered, 25 mg per kg body weight per day for five consecutive days",N/A
 Alaattin Sen,"Effects of benzocaine, benzene and benzon (A) pyrene on gilthead seabream (sparus aurata; sparidae) liver microsomal mixed-function oxidase system",N/A
 Alaattin Sen,"Evaluation of Anti-inflammatory Effect of Novel Fingolimod Based Compound F1-12h in SH-SY5Y, SK-N-SH and U-118MG Cells for the Efficancy in Multiple Sclerosis",N/A
 Alaattin Sen,"Gupta, RP, 73",Thorax
 Alaattin Sen,collected from polluted rivers in Bulgaria and Turkey–preliminary results,N/A
 Q-Schick Auh,Expression of Clusterin in the Salivary Gland under Restraint Stress,Journal of Oral Medicine and Pain
 Q-Schick Auh,구속 스트레스에 의한 타액선 조직내의 Clusterin 발현,N/A
 Q-Schick Auh,KOREAN JOURNAL OF ORAL MEDICINE,N/A
 Q-Schick Auh,KOREAN JOURNAL OF ORAL MEDICINE,N/A
 Q-Schick Auh,KOREAN JOURNAL OF ORAL MEDICINE,N/A
 Seung-Ho Lee,Core 3 O-glycan synthase suppresses tumor formation and metastasis of prostate carcinoma Cells through downregulation of alpha 2 beta 1 integrin complex,Journal of Biological Chemistry
 Seung-Ho Lee,Optimization of Quantification Method of Ergotioneine in Pleurotus eryngii var. ferulae and Its Anti-Oxidant Activity,Journal of the Society of Cosmetic Scientists of Korea
 Seung-Ho Lee,Validation of Stem-loop RT-qPCR Method on the Pharmacokinetic Analysis of siRNA Therapeutics,Journal of Life Science
 Seung-Ho Lee,Expression of recombinant anti-colorectal cancer mAb CO17-1A in SWT4 insect cells,N/A
 Seung-Ho Lee,Enzymatic production and expression of shRNAmir30 from cDNAs,Genes & Genomics
 Rossana Arroyoi,Corrigendum to “α-Actinin TvACTN3 of Trichomonas vaginalis Is an RNA-Binding Protein That Could Participate in Its Posttranscriptional Iron Regulatory Mechanism”,N/A
 Rossana Arroyoi,ACIDOSIS INDUCES CHANGES ON SCAVENGER RECEPTORS EXPRESSION PATTERN OF GLIAL CELLS: EFFECT ON CELL ADHESION AND PHAGOCYTOSIS OF ABETA,GLIA
 Rossana Arroyoi,"Identification, characterization and cloning of Entamoeba histolytica adhesins: Their potential use in diagnosis",N/A
 Rossana Arroyoi,"Identification and characterization of a surface-associated, subtilisin-like serine protease in Trichomonas vaginalis",Parasitology
 Rossana Arroyoi,The struggle for iron-Pathogen vs host-web,N/A
 Yafeng Wang,Minimum Energy Adaptive Structures,Structural and Multidisciplinary Optimization
 Yafeng Wang,Minimum Energy Adaptive Structures–All-In-One Problem Implementation,IASS Symposium 2019 & Structural Membranes 2019-Form and Force
 Yafeng Wang,Topology-finding of Tensegrity Structures Considering Stability Condition,N/A
 Yafeng Wang,Finding generalized and customized tensegrity systems by MILP-based topology optimization,Proceedings of IASS Annual Symposia
 Yafeng Wang,Topology-Finding of Tensegrity Structures Based on Ground Structure Method,Journal of Structural Engineering
 Yubing Zhou,Proteomic mapping of ER-PM junctions in living HEK293 cells,N/A
 Yubing Zhou,Assay for orai calcium channel regulators,Science
 Yubing Zhou,Exploring the Role of Calcium Ions in Biological Systems by Computational Prediction and Protein Engineering,N/A
 Yubing Zhou,This journal is© The Royal Society of Chemistry and Owner Societies 2016,N/A
 Yubing Zhou,in living HEK293 cells,Analytical chemistry
 Jingmin Zhang,Community detection via closure extension,International Journal of Modern Physics C
 Ning Wang,Transition from Solid-like to Fluid-like Behavior of the Cytoskeleton: The Role of Contractile Stress,Journal of Applied Physiology
 Ning Wang,Supplementary Information for Cell material property dictates stress-induced spreading and differentiation in embryonic stem cells,N/A
 Ning Wang,Round Table: Future of Cellular and Molecular Bioengineering and SPRBM,N/A
 Ning Wang,Mechanics and Mechanotransduction of Adherent Cells,Mechanics and Mechanotransduction of Adherent Cells: A Compendium of Atomic Force Microscopy Studies
 Ning Wang,STRESS DISTRIBUTION IN THE CYTOSKELETON,N/A
 Jinhua Jiang,一般概率分布下考虑预防性维修的 ADC 模型可信赖度,信息與控制
 Jinhua Jiang,Compress-and-Forward Performance in Low-SNR Relay Channels,arXiv preprint arXiv:1003.0735
 Jinhua Jiang,Asymptotic capacity of randomly-failing relay networks with DF strategy,"2009 47th Annual Allerton Conference on Communication, Control, and Computing (Allerton)"
 Jinhua Jiang,Utilizing Particle System to simulate airflow of laneway in underground mine environment,2009 17th International Conference on Geoinformatics
 Jinhua Jiang,An open add-on study on cyclophosphamide in patients with refractory myasthenic crisis,JOURNAL-MEDICAL COLLEGES OF PLA-ENGLISH EDITION-
 Fang Ma,Signatures of bosonic Landau levels in a finite-momentum superconductor,Nature
